{
  "$schema": "https://open-triage.dev/schemas/dispatch-message/1.0.0",
  "messageType": "open-triage.dispatch",
  "schemaVersion": "1.0.0",
  "messageId": "11000000-0000-4000-8000-000000000006",
  "sourceRecordId": "SYNTHETIC-SOURCE-RECORD-0006",
  "revision": 1,
  "eventType": "upsert",
  "sentAt": "2026-08-15T09:14:05-04:00",
  "dataModel": {
    "standard": "NEMSIS",
    "version": "3.5.1",
    "dataset": "EMSDataSet"
  },
  "groups": [
    {
      "id": "EMSDataSet",
      "instances": [
        {
          "instanceId": "synthetic-dataset-1",
          "elements": []
        }
      ]
    },
    {
      "id": "HeaderGroup",
      "instances": [
        {
          "instanceId": "synthetic-header-1",
          "parentInstanceId": "synthetic-dataset-1",
          "elements": []
        }
      ]
    },
    {
      "id": "PatientCareReportGroup",
      "instances": [
        {
          "instanceId": "synthetic-pcr-1",
          "parentInstanceId": "synthetic-header-1",
          "elements": []
        }
      ]
    },
    {
      "id": "eResponseSection",
      "instances": [
        {
          "instanceId": "synthetic-response-1",
          "parentInstanceId": "synthetic-pcr-1",
          "elements": [
            {
              "id": "eResponse.03",
              "values": [
                {
                  "kind": "scalar",
                  "occurrenceId": "synthetic-incident-number",
                  "value": "SYN-20260903-006"
                }
              ]
            },
            {
              "id": "eResponse.04",
              "values": [
                {
                  "kind": "scalar",
                  "occurrenceId": "synthetic-response-number",
                  "value": "SYN-20260903-006-1"
                }
              ]
            },
            {
              "id": "eResponse.13",
              "values": [
                {
                  "kind": "scalar",
                  "occurrenceId": "synthetic-vehicle-number",
                  "value": "SYNTHETIC-VEHICLE-7"
                }
              ]
            },
            {
              "id": "eResponse.14",
              "values": [
                {
                  "kind": "scalar",
                  "occurrenceId": "synthetic-call-sign",
                  "value": "SYNTHETIC-MEDIC-7"
                }
              ]
            }
          ]
        }
      ]
    },
    {
      "id": "eDispatchSection",
      "instances": [
        {
          "instanceId": "synthetic-dispatch-1",
          "parentInstanceId": "synthetic-pcr-1",
          "elements": [
            {
              "id": "eDispatch.01",
              "values": [
                {
                  "kind": "coded",
                  "occurrenceId": "synthetic-dispatch-reason",
                  "code": "2301069",
                  "display": "Traffic/Transportation Incident"
                }
              ]
            },
            {
              "id": "eDispatch.05",
              "values": [
                {
                  "kind": "coded",
                  "occurrenceId": "synthetic-dispatch-priority",
                  "code": "2305001",
                  "display": "Critical"
                }
              ]
            }
          ]
        }
      ]
    },
    {
      "id": "eTimesSection",
      "instances": [
        {
          "instanceId": "synthetic-times-1",
          "parentInstanceId": "synthetic-pcr-1",
          "elements": [
            {
              "id": "eTimes.02",
              "values": [
                {
                  "kind": "scalar",
                  "occurrenceId": "synthetic-time-dispatch-notified",
                  "value": "2026-08-15T09:13:52-04:00"
                }
              ]
            },
            {
              "id": "eTimes.03",
              "values": [
                {
                  "kind": "scalar",
                  "occurrenceId": "synthetic-time-unit-notified",
                  "value": "2026-08-15T09:14:00-04:00"
                }
              ]
            }
          ]
        }
      ]
    },
    {
      "id": "ePatientSection",
      "instances": [
        {
          "instanceId": "synthetic-patient-1",
          "parentInstanceId": "synthetic-pcr-1",
          "elements": [
            {
              "id": "ePatient.01",
              "values": [
                {
                  "kind": "scalar",
                  "occurrenceId": "synthetic-patient-id",
                  "value": "194302096997"
                }
              ]
            },
            {
              "id": "ePatient.17",
              "values": [
                {
                  "kind": "scalar",
                  "occurrenceId": "synthetic-patient-dob",
                  "value": "1943-02-09"
                }
              ]
            },
            {
              "id": "ePatient.25",
              "values": [
                {
                  "kind": "coded",
                  "occurrenceId": "synthetic-patient-sex",
                  "code": "9919003",
                  "display": "Male"
                }
              ]
            },
            {
              "id": "ePatient.18",
              "values": [
                {
                  "kind": "scalar",
                  "occurrenceId": "synthetic-phone-home",
                  "value": "+46 70 000 00 02",
                  "attributes": {
                    "PhoneNumberType": "9913003"
                  }
                }
              ]
            },
            {
              "id": "ePatient.05",
              "values": [
                {
                  "kind": "scalar",
                  "occurrenceId": "synthetic-ePatient.05",
                  "value": "Ängsbacken 8 A"
                }
              ]
            },
            {
              "id": "ePatient.09",
              "values": [
                {
                  "kind": "scalar",
                  "occurrenceId": "synthetic-ePatient.09",
                  "value": "31134"
                }
              ]
            }
          ]
        }
      ]
    },
    {
      "id": "ePatient.PatientNameGroup",
      "instances": [
        {
          "instanceId": "synthetic-patient-name-1",
          "parentInstanceId": "synthetic-patient-1",
          "elements": [
            {
              "id": "ePatient.02",
              "values": [
                {
                  "kind": "scalar",
                  "occurrenceId": "synthetic-patient-last-name",
                  "value": "Bergström"
                }
              ]
            },
            {
              "id": "ePatient.03",
              "values": [
                {
                  "kind": "scalar",
                  "occurrenceId": "synthetic-patient-first-name",
                  "value": "Arne"
                }
              ]
            },
            {
              "id": "ePatient.04",
              "values": [
                {
                  "kind": "scalar",
                  "occurrenceId": "synthetic-patient-middle-name",
                  "value": "Gustav"
                }
              ]
            }
          ]
        }
      ]
    },
    {
      "id": "eSceneSection",
      "instances": [
        {
          "instanceId": "synthetic-scene-1",
          "parentInstanceId": "synthetic-pcr-1",
          "elements": [
            {
              "id": "eScene.11",
              "values": [
                {
                  "kind": "scalar",
                  "occurrenceId": "synthetic-scene-gps",
                  "value": "40.748817,-73.985428"
                }
              ]
            },
            {
              "id": "eScene.15",
              "values": [
                {
                  "kind": "scalar",
                  "occurrenceId": "synthetic-scene-street",
                  "value": "600 SYNTHETIC TRAFFIC BOULEVARD"
                }
              ]
            },
            {
              "id": "eScene.16",
              "values": [
                {
                  "kind": "scalar",
                  "occurrenceId": "synthetic-scene-apartment",
                  "value": "MARKER SYN-06"
                }
              ]
            },
            {
              "id": "eScene.18",
              "values": [
                {
                  "kind": "coded",
                  "occurrenceId": "synthetic-scene-state",
                  "code": "36",
                  "system": "ANSI-STATE",
                  "display": "New York"
                }
              ]
            },
            {
              "id": "eScene.19",
              "values": [
                {
                  "kind": "scalar",
                  "occurrenceId": "synthetic-scene-zip",
                  "value": "10001"
                }
              ]
            },
            {
              "id": "eScene.21",
              "values": [
                {
                  "kind": "coded",
                  "occurrenceId": "synthetic-scene-county",
                  "code": "36061",
                  "system": "ANSI-COUNTY",
                  "display": "New York County, NY"
                }
              ]
            }
          ]
        }
      ]
    }
  ]
}
